{
  "$schema": "../namchain-engine-schema.schema.json",
  "ok": true,
  "protocol": 2,
  "max_chains": 8,
  "stereo": false,
  "nodes": [
    {
      "id": "nc.gain",
      "name": "Gain",
      "category": "utility",
      "kind": "primitive",
      "ports": {
        "in": [{ "name": "in0", "channels": 1, "optional": true }],
        "out": [{ "name": "out0", "channels": 1, "optional": false }]
      },
      "arity": null,
      "flags": {
        "stateful": true,
        "has_lookback": false,
        "has_tail": false,
        "bypassable": true,
        "block_delay": false
      },
      "latency_samples": 0,
      "tail_samples": 0,
      "params": [
        {
          "id": "gain_db",
          "name": "Gain",
          "kind": "number",
          "unit": "dB",
          "default": 0.0,
          "min": -60.0,
          "min_inclusive": true,
          "max": 24.0,
          "max_inclusive": true,
          "step": null,
          "snap": false,
          "scale": "linear",
          "rampable": true,
          "patchable": true,
          "hidden": false,
          "required": false,
          "one_of": null,
          "one_of_required": false,
          "options_from": null,
          "options": null
        },
        {
          "id": "gain",
          "name": "Gain (linear)",
          "kind": "number",
          "unit": null,
          "default": 1.0,
          "min": -8.0,
          "min_inclusive": true,
          "max": 16.0,
          "max_inclusive": true,
          "step": null,
          "snap": false,
          "scale": "linear",
          "rampable": true,
          "patchable": true,
          "hidden": true,
          "required": false,
          "one_of": null,
          "one_of_required": false,
          "options_from": null,
          "options": null
        },
        {
          "id": "ramp_ms",
          "name": "Ramp",
          "kind": "number",
          "unit": "ms",
          "default": 5.0,
          "min": 0.0,
          "min_inclusive": true,
          "max": 1000.0,
          "max_inclusive": true,
          "step": null,
          "snap": false,
          "scale": "linear",
          "rampable": false,
          "patchable": true,
          "hidden": false,
          "required": false,
          "one_of": null,
          "one_of_required": false,
          "options_from": null,
          "options": null
        }
      ],
      "per_port_params": []
    },
    {
      "id": "fx.amp.tonestack",
      "name": "Tone stack",
      "category": "amp",
      "kind": "macro",
      "inputs": 1,
      "outputs": 1,
      "channels": 1,
      "stereo": false,
      "bypass": "roles",
      "roles": [
        { "role": "bass", "type": "nc.eq.biquad" },
        { "role": "mid", "type": "nc.eq.biquad" },
        { "role": "treble", "type": "nc.eq.biquad" }
      ],
      "params": [
        {
          "id": "bass",
          "name": "Bass",
          "kind": "number",
          "unit": "dB",
          "default": 0.0,
          "min": -18.0,
          "min_inclusive": true,
          "max": 18.0,
          "max_inclusive": true,
          "step": null,
          "snap": false,
          "scale": "linear",
          "rampable": true,
          "patchable": true,
          "hidden": false,
          "required": false,
          "one_of": null,
          "one_of_required": false,
          "options_from": null,
          "options": null,
          "targets": [
            { "role": "bass", "param": "gain_db", "transform": "direct", "scale": 0.0 }
          ]
        },
        {
          "id": "mid",
          "name": "Mid",
          "kind": "number",
          "unit": "dB",
          "default": 0.0,
          "min": -18.0,
          "min_inclusive": true,
          "max": 18.0,
          "max_inclusive": true,
          "step": null,
          "snap": false,
          "scale": "linear",
          "rampable": true,
          "patchable": true,
          "hidden": false,
          "required": false,
          "one_of": null,
          "one_of_required": false,
          "options_from": null,
          "options": null,
          "targets": [
            { "role": "mid", "param": "gain_db", "transform": "direct", "scale": 0.0 }
          ]
        },
        {
          "id": "treble",
          "name": "Treble",
          "kind": "number",
          "unit": "dB",
          "default": 0.0,
          "min": -18.0,
          "min_inclusive": true,
          "max": 18.0,
          "max_inclusive": true,
          "step": null,
          "snap": false,
          "scale": "linear",
          "rampable": true,
          "patchable": true,
          "hidden": false,
          "required": false,
          "one_of": null,
          "one_of_required": false,
          "options_from": null,
          "options": null,
          "targets": [
            { "role": "treble", "param": "gain_db", "transform": "direct", "scale": 0.0 }
          ]
        },
        {
          "id": "mid_freq",
          "name": "Mid frequency",
          "kind": "number",
          "unit": "Hz",
          "default": 500.0,
          "min": 200.0,
          "min_inclusive": true,
          "max": 2000.0,
          "max_inclusive": true,
          "step": null,
          "snap": false,
          "scale": "log",
          "rampable": true,
          "patchable": true,
          "hidden": false,
          "required": false,
          "one_of": null,
          "one_of_required": false,
          "options_from": null,
          "options": null,
          "targets": [
            { "role": "mid", "param": "freq", "transform": "direct", "scale": 0.0 }
          ]
        }
      ]
    }
  ]
}
